{
  "rights_id": "rgt-project-001",
  "asset_path": "",
  "asset_hash": "sha256:REPLACE",
  "asset_type": "other",
  "creator_or_provider": "",
  "source": "",
  "acquired_at": "",
  "creation_method": "other",
  "model_or_tool": null,
  "human_contribution": "",
  "license_or_contract": null,
  "commercial_use": false,
  "modification_allowed": null,
  "attribution": null,
  "territories": ["WORLD"],
  "formats": ["paperback"],
  "term_end": null,
  "consent_evidence": null,
  "disclosure_obligations": [],
  "evidence_paths": [],
  "clearance_status": "unknown",
  "notes": ""
}
